{
	"contractVersion": 1,
	"projectId": "veszprem-downtown-wayfinding",
	"source": {
		"kind": "illustrated-map",
		"presentation": "source-overlay",
		"levels": 1,
		"equivalentRedrawAllowed": true
	},
	"guidance": {
		"targetMode": "highlight",
		"allowFallback": true,
		"stepFreeRequired": false
	},
	"evidence": {
		"destinationMetadata": {
			"status": "confirmed",
			"provenance": "customer-provided",
			"artifact": "VeszpremTerkep.png numbered landmark legend",
			"review": { "method": "source-authority", "reviewerType": "authoritative-source", "reviewedBy": "supplied tourism map" }
		},
		"destinationAnchors": {
			"status": "confirmed",
			"provenance": "customer-provided",
			"artifact": "map.svg hit geometry aligned to numbered symbols",
			"review": { "method": "source-authority", "reviewerType": "authoritative-source", "reviewedBy": "numbered symbols on supplied tourism map" }
		},
		"currentLocationAnchors": {
			"status": "confirmed",
			"provenance": "customer-provided",
			"artifact": "Tourinform current-location pin",
			"review": { "method": "source-authority", "reviewerType": "authoritative-source", "reviewedBy": "supplied tourism map" }
		},
		"orientation": { "status": "unavailable", "provenance": "customer-provided" },
		"walkableSpace": { "status": "unavailable", "provenance": "image-analysis", "independentFrom": ["routeTopology"] },
		"routeTopology": { "status": "unavailable", "provenance": "ai-inferred" },
		"entranceApproaches": { "status": "unavailable", "provenance": "ai-inferred" },
		"levelTransitions": { "status": "unavailable", "provenance": "customer-provided" },
		"accessibility": { "status": "unavailable", "provenance": "customer-provided" }
	}
}
